"name_1006","freq","ensembl_gene_id","go_id","definition_1006","namespace_1003"
"anchoring junction",5,"ENSG00000163531","GO:0070161","A cell junction that mechanically attaches a cell (and its cytoskeleton) to neighboring cells or to the extracellular matrix.","cellular_component"
"apoptotic process",4,"ENSG00000074603","GO:0006915","A programmed cell death process which begins when a cell receives an internal (e.g. DNA damage) or external signal (e.g. an extracellular death ligand), and proceeds through a series of biochemical events (signaling pathway phase) which trigger an execution phase. The execution phase is the last step of an apoptotic process, and is typically characterized by rounding-up of the cell, retraction of pseudopodes, reduction of cellular volume (pyknosis), chromatin condensation, nuclear fragmentation (karyorrhexis), plasma membrane blebbing and fragmentation of the cell into apoptotic bodies. When the execution phase is completed, the cell has died.","biological_process"
"ATP binding",14,"ENSG00000168872","GO:0005524","Binding to ATP, adenosine 5'-triphosphate, a universally important coenzyme and enzyme regulator.","molecular_function"
"axon",4,"ENSG00000163531","GO:0030424","The long process of a neuron that conducts nerve impulses, usually away from the cell body to the terminals and varicosities, which are sites of storage and release of neurotransmitter.","cellular_component"
"calcium ion binding",6,"ENSG00000162551","GO:0005509","Binding to a calcium ion (Ca2+).","molecular_function"
"cell-cell adhesion",4,"ENSG00000138448","GO:0098609","The attachment of one cell to another cell via adhesion molecules.","biological_process"
"cell adhesion",8,"ENSG00000051382","GO:0007155","The attachment of a cell, either to another cell or to an underlying substrate such as the extracellular matrix, via cell adhesion molecules.","biological_process"
"cell differentiation",12,"ENSG00000158161","GO:0030154","The cellular developmental process in which a relatively unspecialized cell, e.g. embryonic or regenerative cell, acquires specialized structural and/or functional features that characterize a specific cell. Differentiation includes the processes involved in commitment of a cell to a specific fate and its subsequent development to the mature state.","biological_process"
"cell projection",10,"ENSG00000173166","GO:0042995","A prolongation or process extending from a cell, e.g. a flagellum or axon.","cellular_component"
"cell surface",4,"ENSG00000196549","GO:0009986","The external part of the cell wall and/or plasma membrane.","cellular_component"
"centrosome",7,"ENSG00000116198","GO:0005813","A structure comprised of a core structure (in most organisms, a pair of centrioles) and peripheral material from which a microtubule-based structure, such as a spindle apparatus, is organized. Centrosomes occur close to the nucleus during interphase in many eukaryotic cells, though in animal cells it changes continually during the cell-division cycle.","cellular_component"
"chromatin remodeling",7,"ENSG00000160469","GO:0006338","A dynamic process of chromatin reorganization resulting in changes to chromatin structure. These changes allow DNA metabolic processes such as transcriptional regulation, DNA recombination, DNA repair, and DNA replication.","biological_process"
"cilium",6,"ENSG00000048342","GO:0005929","A specialized eukaryotic organelle that consists of a filiform extrusion of the cell surface and of some cytoplasmic parts. Each cilium is largely bounded by an extrusion of the cytoplasmic (plasma) membrane, and contains a regular longitudinal array of microtubules, anchored to a basal body.","cellular_component"
"cytoplasm",51,"ENSG00000109339","GO:0005737","The contents of a cell excluding the plasma membrane and nucleus, but including other subcellular structures.","cellular_component"
"cytoplasmic vesicle",5,"ENSG00000122012","GO:0031410","A vesicle found in the cytoplasm of a cell.","cellular_component"
"cytoskeleton",13,"ENSG00000154114","GO:0005856","A cellular structure that forms the internal framework of eukaryotic and prokaryotic cells. The cytoskeleton includes intermediate filaments, microfilaments, microtubules, the microtrabecular lattice, and other structures characterized by a polymeric filamentous nature and long-range order within the cell. The various elements of the cytoskeleton not only serve in the maintenance of cellular shape but also have roles in other cellular functions, including cellular movement, cell division, endocytosis, and movement of organelles.","cellular_component"
"cytosol",38,"ENSG00000074603","GO:0005829","The part of the cytoplasm that does not contain organelles but which does contain other particulate matter, such as protein complexes.","cellular_component"
"dendrite",5,"ENSG00000196549","GO:0030425","A neuron projection that has a short, tapering, morphology. Dendrites receive and integrate signals from other neurons or from sensory stimuli, and conduct nerve impulses towards the axon or the cell body. In most neurons, the impulse is conveyed from dendrites to axon via the cell body, but in some types of unipolar neuron, the impulse does not travel via the cell body.","cellular_component"
"DNA binding",5,"ENSG00000064961","GO:0003677","Any molecular function by which a gene product interacts selectively and non-covalently with DNA (deoxyribonucleic acid).","molecular_function"
"early endosome",4,"ENSG00000177879","GO:0005769","A membrane-bounded organelle that receives incoming material from primary endocytic vesicles that have been generated by clathrin-dependent and clathrin-independent endocytosis; vesicles fuse with the early endosome to deliver cargo for sorting into recycling or degradation pathways.","cellular_component"
"endoplasmic reticulum",9,"ENSG00000172893","GO:0005783","The irregular network of unit membranes, visible only by electron microscopy, that occurs in the cytoplasm of many eukaryotic cells. The membranes form a complex meshwork of tubular channels, which are often expanded into slitlike cavities called cisternae. The ER takes two forms, rough (or granular), with ribosomes adhering to the outer surface, and smooth (with no ribosomes attached).","cellular_component"
"endoplasmic reticulum lumen",4,"ENSG00000140284","GO:0005788","The volume enclosed by the membranes of the endoplasmic reticulum.","cellular_component"
"endoplasmic reticulum membrane",7,"ENSG00000146233","GO:0005789","The lipid bilayer surrounding the endoplasmic reticulum.","cellular_component"
"endosome",6,"ENSG00000136279","GO:0005768","A vacuole to which materials ingested by endocytosis are delivered.","cellular_component"
"extracellular exosome",10,"ENSG00000136279","GO:0070062","A vesicle that is released into the extracellular region by fusion of the limiting endosomal membrane of a multivesicular body with the plasma membrane. Extracellular exosomes, also simply called exosomes, have a diameter of about 40-100 nm.","cellular_component"
"extracellular region",16,"ENSG00000100504","GO:0005576","The space external to the outermost structure of a cell. For cells without external protective or external encapsulating structures this refers to space outside of the plasma membrane. This term covers the host cell environment outside an intracellular parasite.","cellular_component"
"extracellular space",8,"ENSG00000198734","GO:0005615","That part of a multicellular organism outside the cells proper, usually taken to be outside the plasma membranes, and occupied by fluid.","cellular_component"
"ficolin-1-rich granule lumen",4,"ENSG00000136279","GO:1904813","Any membrane-enclosed lumen that is part of a ficolin-1-rich granule.","cellular_component"
"focal adhesion",5,"ENSG00000196549","GO:0005925","A cell-substrate junction that anchors the cell to the extracellular matrix and that forms a point of termination of actin filaments. In insects focal adhesion has also been referred to as hemi-adherens junction (HAJ).","cellular_component"
"G protein-coupled receptor signaling pathway",5,"ENSG00000051382","GO:0007186","The series of molecular signals initiated by a ligand binding to its receptor, in which the activated receptor promotes the exchange of GDP for GTP on the alpha-subunit of an associated heterotrimeric G-protein complex. The GTP-bound activated alpha-G-protein then dissociates from the beta- and gamma-subunits to further transmit the signal within the cell. The pathway begins with receptor-ligand interaction, and ends with regulation of a downstream cellular process. The pathway can start from the plasma membrane, Golgi or nuclear membrane.","biological_process"
"glutamatergic synapse",8,"ENSG00000136279","GO:0098978","A synapse that uses glutamate as a neurotransmitter.","cellular_component"
"Golgi apparatus",7,"ENSG00000136279","GO:0005794","A membrane-bound cytoplasmic organelle of the endomembrane system that further processes the core oligosaccharides (e.g. N-glycans) added to proteins in the endoplasmic reticulum and packages them into membrane-bound vesicles. The Golgi apparatus operates at the intersection of the secretory, lysosomal, and endocytic pathways.","cellular_component"
"guanyl-nucleotide exchange factor activity",4,"ENSG00000119979","GO:0005085","Stimulates the exchange of GDP to GTP on a signaling GTPase, changing its conformation to its active form. Guanine nucleotide exchange factors (GEFs) act by stimulating the release of guanosine diphosphate (GDP) to allow binding of guanosine triphosphate (GTP), which is more abundant in the cell under normal cellular physiological conditions.","molecular_function"
"hydrolase activity",6,"ENSG00000152104","GO:0016787","Catalysis of the hydrolysis of various bonds, e.g. C-O, C-N, C-C, phosphoric anhydride bonds, etc.","molecular_function"
"identical protein binding",8,"ENSG00000100504","GO:0042802","Binding to an identical protein or proteins.","molecular_function"
"immune response",4,"ENSG00000158270","GO:0006955","Any immune system process that functions in the calibrated response of an organism to a potential internal or invasive threat.","biological_process"
"intracellular membrane-bounded organelle",8,"ENSG00000025423","GO:0043231","Organized structure of distinctive morphology and function, bounded by a single or double lipid bilayer membrane and occurring within the cell. Includes the nucleus, mitochondria, plastids, vacuoles, and vesicles. Excludes the plasma membrane.","cellular_component"
"lysosome",4,"ENSG00000152700","GO:0005764","A small lytic vacuole that has cell cycle-independent morphology found in most animal cells and that contains a variety of hydrolases, most of which have their maximal activities in the pH range 5-6. The contained enzymes display latency if properly isolated. About 40 different lysosomal hydrolases are known and lysosomes have a great variety of morphologies and functions.","cellular_component"
"membrane",39,"ENSG00000184988","GO:0016020","A lipid bilayer along with all the proteins and protein complexes embedded in it and attached to it.","cellular_component"
"metal ion binding",21,"ENSG00000138448","GO:0046872","Binding to a metal ion.","molecular_function"
"methylation",4,"ENSG00000142611","GO:0032259","The process in which a methyl group is covalently attached to a molecule.","biological_process"
"methyltransferase activity",4,"ENSG00000117543","GO:0008168","Catalysis of the transfer of a methyl group to an acceptor molecule.","molecular_function"
"mitochondrion",11,"ENSG00000162851","GO:0005739","A semiautonomous, self replicating organelle that occurs in varying numbers, shapes, and sizes in the cytoplasm of virtually all eukaryotic cells. It is notably the site of tissue respiration.","cellular_component"
"nuclear body",7,"ENSG00000064961","GO:0016604","Extra-nucleolar nuclear domains usually visualized by confocal microscopy and fluorescent antibodies to specific proteins.","cellular_component"
"nucleic acid binding",4,"ENSG00000065427","GO:0003676","Binding to a nucleic acid.","molecular_function"
"nucleolus",4,"ENSG00000141456","GO:0005730","A small, dense body one or more of which are present in the nucleus of eukaryotic cells. It is rich in RNA and protein, is not bounded by a limiting membrane, and is not seen during mitosis. Its prime function is the transcription of the nucleolar DNA into 45S ribosomal-precursor RNA, the processing of this RNA into 5.8S, 18S, and 28S components of ribosomal RNA, and the association of these components with 5S RNA and proteins synthesized outside the nucleolus. This association results in the formation of ribonucleoprotein precursors; these pass into the cytoplasm and mature into the 40S and 60S subunits of the ribosome.","cellular_component"
"nucleoplasm",30,"ENSG00000119383","GO:0005654","That part of the nuclear content other than the chromosomes or the nucleolus.","cellular_component"
"nucleus",35,"ENSG00000169220","GO:0005634","A membrane-bounded organelle of eukaryotic cells in which chromosomes are housed and replicated. In most cells, the nucleus contains all of the cell's chromosomes except the organellar chromosomes, and is the site of RNA synthesis and processing. In some species, or in specialized cell types, RNA metabolism or DNA replication may be absent.","cellular_component"
"plasma membrane",40,"ENSG00000198734","GO:0005886","The membrane surrounding a cell that separates the cell from its external environment. It consists of a phospholipid bilayer and associated proteins.","cellular_component"
"positive regulation of cell population proliferation",4,"ENSG00000213699","GO:0008284","Any process that activates or increases the rate or extent of cell proliferation.","biological_process"
"positive regulation of DNA-templated transcription",4,"ENSG00000142611","GO:0045893","Any process that activates or increases the frequency, rate or extent of cellular DNA-templated transcription.","biological_process"
"positive regulation of gene expression",4,"ENSG00000051382","GO:0010628","Any process that increases the frequency, rate or extent of gene expression. Gene expression is the process in which a gene's coding sequence is converted into a mature gene product (protein or RNA).","biological_process"
"positive regulation of transcription by RNA polymerase II",4,"ENSG00000128342","GO:0045944","Any process that activates or increases the frequency, rate or extent of transcription from an RNA polymerase II promoter.","biological_process"
"postsynaptic density",4,"ENSG00000198010","GO:0014069","An electron dense network of proteins within and adjacent to the postsynaptic membrane of an asymmetric, neuron-neuron synapse. Its major components include neurotransmitter receptors and the proteins that spatially and functionally organize them such as anchoring and scaffolding molecules, signaling enzymes and cytoskeletal components.","cellular_component"
"presynapse",4,"ENSG00000136279","GO:0098793","The part of a synapse that is part of the presynaptic cell.","cellular_component"
"protein binding",80,"ENSG00000172893","GO:0005515","Binding to a protein.","molecular_function"
"protein homodimerization activity",7,"ENSG00000147601","GO:0042803","Binding to an identical protein to form a homodimer.","molecular_function"
"protein kinase activity",5,"ENSG00000160469","GO:0004672","Catalysis of the phosphorylation of an amino acid residue in a protein, usually according to the reaction: a protein + ATP = a phosphoprotein + ADP.","molecular_function"
"protein phosphorylation",5,"ENSG00000086232","GO:0006468","The process of introducing a phosphate group on to a protein.","biological_process"
"protein serine kinase activity",6,"ENSG00000160469","GO:0106310","Catalysis of the reactions: ATP + protein serine = ADP + protein serine phosphate.","molecular_function"
"protein serine/threonine kinase activity",5,"ENSG00000109339","GO:0004674","Catalysis of the reactions: ATP + protein serine = ADP + protein serine phosphate, and ATP + protein threonine = ADP + protein threonine phosphate.","molecular_function"
"protein transport",6,"ENSG00000148356","GO:0015031","The directed movement of proteins into, out of or within a cell, or between cells, by means of some agent such as a transporter or pore.","biological_process"
"proteolysis",8,"ENSG00000074603","GO:0006508","The hydrolysis of proteins into smaller polypeptides and/or amino acids by cleavage of their peptide bonds.","biological_process"
"regulation of DNA-templated transcription",4,"ENSG00000163346","GO:0006355","Any process that modulates the frequency, rate or extent of cellular DNA-templated transcription.","biological_process"
"regulation of transcription by RNA polymerase II",5,"ENSG00000142611","GO:0006357","Any process that modulates the frequency, rate or extent of transcription mediated by RNA polymerase II.","biological_process"
"RNA binding",8,"ENSG00000092345","GO:0003723","Binding to an RNA molecule or a portion thereof.","molecular_function"
"signal transduction",4,"ENSG00000109339","GO:0007165","The cellular process in which a signal is conveyed to trigger a change in the activity or state of a cell. Signal transduction begins with reception of a signal (e.g. a ligand binding to a receptor or receptor activation by a stimulus such as light), or for signal transduction in the absence of ligand, signal-withdrawal or the activity of a constitutively active receptor. Signal transduction ends with regulation of a downstream cellular process, e.g. regulation of transcription or regulation of a metabolic process. Signal transduction covers signaling from receptors located on the surface of the cell and signaling via molecules located within the cell. For signaling between cells, signal transduction is restricted to events at and within the receiving cell.","biological_process"
"signaling receptor binding",6,"ENSG00000110888","GO:0005102","Binding to one or more specific sites on a receptor molecule, a macromolecule that undergoes combination with a hormone, neurotransmitter, drug or intracellular messenger to initiate a change in cell function.","molecular_function"
"spermatogenesis",6,"ENSG00000159409","GO:0007283","The developmental process by which male germ line stem cells self renew or give rise to successive cell types resulting in the development of a spermatozoa.","biological_process"
"synapse",11,"ENSG00000069188","GO:0045202","The junction between an axon of one neuron and a dendrite of another neuron, a muscle fiber or a glial cell. As the axon approaches the synapse it enlarges into a specialized structure, the presynaptic terminal bouton, which contains mitochondria and synaptic vesicles. At the tip of the terminal bouton is the presynaptic membrane; facing it, and separated from it by a minute cleft (the synaptic cleft) is a specialized area of membrane on the receiving cell, known as the postsynaptic membrane. In response to the arrival of nerve impulses, the presynaptic terminal bouton secretes molecules of neurotransmitters into the synaptic cleft. These diffuse across the cleft and transmit the signal to the postsynaptic membrane.","cellular_component"
"transcription coregulator activity",4,"ENSG00000152104","GO:0003712","A transcription regulator activity that modulates the transcription of specific gene sets via binding to a DNA-bound DNA-binding transcription factor, either on its own or as part of a complex. Coregulators often act by altering chromatin structure and modifications. For example, one class of transcription coregulators modifies chromatin structure through covalent modification of histones. A second class remodels the conformation of chromatin in an ATP-dependent fashion. A third class modulates interactions of DNA-bound DNA-binding transcription factors with other transcription coregulators.","molecular_function"
"zinc ion binding",6,"ENSG00000137871","GO:0008270","Binding to a zinc ion (Zn).","molecular_function"
